<?xml version='1.0' encoding='UTF-8' standalone='no'?>
<!DOCTYPE frameset PUBLIC "-//PB//PropBank Frame v3.4 Transitional//EN" "http://propbank.org/specification/dtds/v3.4/frameset.dtd">
<frameset>
  <predicate lemma="peri">
    <roleset id="peri.01" name="occurring in the time around a particular event">
      <aliases>
        <alias pos="f">peri</alias>
        <alias pos="f">peri-</alias>
      </aliases>
      <roles>
        <role descr="thing occurring around the time of ARG2" f="PPT" n="1"/>
        <role descr="reference event" f="PPT" n="2"/>
      </roles>
      <usagenotes>
        <usage resource="PropBank" version="1.0" inuse="-"/>
        <usage resource="PropBank" version="2.1.5" inuse="-"/>
        <usage resource="PropBank" version="3.1" inuse="-"/>
        <usage resource="PropBank" version="3.4" inuse="-"/>
        <usage resource="AMR" version="2019" inuse="-"/>
        <usage resource="PropBank" version="Flickr 1.0" inuse="-"/>
        <usage resource="AMR" version="Spatial 1.0" inuse="-"/>
        <usage resource="AMR" version="THYME 1.0" inuse="+"/>
        <usage resource="PropBank" version="3.5" inuse="-"/>
        <usage resource="AMR" version="iSAT 1.0" inuse="-"/>
      </usagenotes>
      <lexlinks/>
      <example name="peri-f, both args" src="THYME-colon-mod">
        <text>They will see her for management of her diabetes perioperatively .</text>
        <propbank/>
        <amr version="THYME 1.0">
          (s2 / see-09
            :ARG0 (t / they)
            :ARG1 s
            :ARG2 (m / manage-01
              :ARG0 t
              :ARG1 (d / disease-disorder :name (n / name :op1 "diabetes")
                :poss (s / she))
              :ARG1-of (p / peri-01
                :ARG2 (o / operate-02
                  :ARG2 s)))) 
        </amr>
      </example>
      <note>NOTES: Added for THYME-AMR. A closed list of prefix frames (intra.01, peri.01, post.05, pre.01) were created to resolve temporal conflicts generated in the merged THYME AMR-THYME 2 annotations. They are to be used in tandem with frames that represent the terms' roots, but only when they convey temporal information. They should not be used for spatial senses (like "perirectal") or other non-temporal senses.</note>
    </roleset>
  </predicate>
</frameset>
