<?xml version='1.0' encoding='UTF-8' standalone='no'?>
<!DOCTYPE frameset PUBLIC "-//PB//PropBank Frame v3.4 Transitional//EN" "http://propbank.org/specification/dtds/v3.4/frameset.dtd">
<frameset>
  <predicate lemma="journey">
    <roleset id="journey.01" name="travel">
      <aliases>
        <alias pos="v">journey</alias>
        <alias pos="n">journey</alias>
      </aliases>
      <roles>
        <role descr="traveller" f="PAG" n="0">
          <rolelinks>
            <rolelink class="run-51.3.2-1" resource="VerbNet" version="verbnet3.3">agent</rolelink>
          </rolelinks>
        </role>
      </roles>
      <usagenotes>
        <usage resource="PropBank" version="1.0" inuse="-"/>
        <usage resource="PropBank" version="2.1.5" inuse="+"/>
        <usage resource="PropBank" version="3.1" inuse="+"/>
        <usage resource="PropBank" version="3.4" inuse="+"/>
        <usage resource="AMR" version="2019" inuse="+"/>
        <usage resource="PropBank" version="Flickr 1.0" inuse="+"/>
        <usage resource="AMR" version="Spatial 1.0" inuse="+"/>
        <usage resource="AMR" version="THYME 1.0" inuse="+"/>
        <usage resource="PropBank" version="3.5" inuse="+"/>
        <usage resource="AMR" version="iSAT 1.0" inuse="+"/>
      </usagenotes>
      <lexlinks>
        <lexlink class="Travel" confidence="0.8" resource="FrameNet" src="manual+strict-conv" version="1.7"/>
        <lexlink class="run-51.3.2-1" confidence="0.8" resource="VerbNet" src="manual+strict-conv" version="verbnet3.3"/>
        <lexlink class="Transportperson" confidence="0.1" resource="ERE" src="reo-expansion" version="rich"/>
        <lexlink class="run-51.3.2-1" confidence="1.0" resource="VerbNet" src="manualchecks" version="verbnet3.4"/>
      </lexlinks>
      <example name="get out of town" src="">
        <text>Giffen had already urged him to journey south , if only for a few days to clear up matters .</text>
        <propbank>
          <rel relloc="6">journey</rel>
          <arg type="ARG0" start="4" end="4">him</arg>
          <arg type="ARGM-DIR" start="7" end="7">south</arg>
          <arg type="ARGM-ADV" start="9" end="14">if only for a few days</arg>
          <arg type="ARGM-PNC" start="15" end="18">to clear up matters</arg>
        </propbank>
      </example>
      <example name="arg 0 and debateable dir (could be gol too)" src="">
        <text>His hometown journey</text>
        <propbank>
          <rel relloc="2">journey</rel>
          <arg type="ARG0" start="0" end="0">His</arg>
          <arg type="ARGM-DIR" start="1" end="1">hometown</arg>
        </propbank>
      </example>
      <note>JOURNEY-V NOTES: Framed by Ben. (from journey.01-v)</note>
      <note>JOURNEY-N NOTES: Based on sentences in wsj. Comparison to journey.01. VN class run-51.3.2. Framed by Katie. (from journey.01-n)</note>
    </roleset>
  </predicate>
</frameset>
