<?xml version='1.0' encoding='UTF-8' standalone='no'?>
<!DOCTYPE frameset PUBLIC "-//PB//PropBank Frame v3.4 Transitional//EN" "http://propbank.org/specification/dtds/v3.4/frameset.dtd">
<frameset>
  <predicate lemma="unteach">
    <roleset id="unteach.01" name="make forget learning">
      <aliases>
        <alias pos="v">unteach</alias>
      </aliases>
      <roles>
        <role descr="unteacher" f="PAG" n="0"/>
        <role descr="subject" f="PPT" n="1"/>
        <role descr="(former) student" f="GOL" n="2"/>
      </roles>
      <usagenotes>
        <usage resource="PropBank" version="1.0" inuse="-"/>
        <usage resource="PropBank" version="2.1.5" inuse="+"/>
        <usage resource="PropBank" version="3.1" inuse="+"/>
        <usage resource="PropBank" version="3.4" inuse="+"/>
        <usage resource="AMR" version="2019" inuse="+"/>
        <usage resource="PropBank" version="Flickr 1.0" inuse="+"/>
        <usage resource="AMR" version="Spatial 1.0" inuse="+"/>
        <usage resource="AMR" version="THYME 1.0" inuse="+"/>
        <usage resource="PropBank" version="3.5" inuse="+"/>
        <usage resource="AMR" version="iSAT 1.0" inuse="+"/>
      </usagenotes>
      <lexlinks/>
      <example name="unteach-v: transitive" src="">
        <text>`` And God help anyone who tries to unteach you '' ! ! Grumbled Michelangelo ; ; yet he knew that he had nothing to grumble about , for Argiento made few demands on him .</text>
        <propbank>
          <rel relloc="8">unteach</rel>
          <arg type="R-ARG0" start="4" end="4">anyone</arg>
          <arg type="ARG0" start="5" end="5">who</arg>
          <arg type="ARG2" start="9" end="9">you</arg>
        </propbank>
      </example>
      <note>UNTEACH-V NOTES: frames created by Ben. c.f. 'teach'. No Vncls. (from unteach.01-v)</note>
    </roleset>
  </predicate>
</frameset>
