<?xml version='1.0' encoding='UTF-8' standalone='no'?>
<!DOCTYPE frameset PUBLIC "-//PB//PropBank Frame v3.4 Transitional//EN" "http://propbank.org/specification/dtds/v3.4/frameset.dtd">
<frameset>
  <predicate lemma="bloodwork">
    <roleset id="bloodwork.01" name="draw/test blood components">
      <aliases>
        <alias pos="n">blood_counts</alias>
        <alias pos="n">blood_work</alias>
        <alias pos="n">bloodwork</alias>
        <alias pos="n">blood_tests</alias>
      </aliases>
      <roles>
        <role descr="performer" f="PAG" n="0"/>
        <role descr="patient" f="PPT" n="1"/>
      </roles>
      <usagenotes>
        <usage resource="PropBank" version="1.0" inuse="-"/>
        <usage resource="PropBank" version="2.1.5" inuse="-"/>
        <usage resource="PropBank" version="3.1" inuse="-"/>
        <usage resource="PropBank" version="3.4" inuse="+"/>
        <usage resource="AMR" version="2019" inuse="-"/>
        <usage resource="AMR" version="THYME 1.0" inuse="+"/>
        <usage resource="PropBank" version="Flickr 1.0" inuse="-"/>
        <usage resource="AMR" version="Spatial 1.0" inuse="-"/>
        <usage resource="PropBank" version="3.5" inuse="+"/>
        <usage resource="AMR" version="iSAT 1.0" inuse="+"/>
      </usagenotes>
      <lexlinks/>
      <example name="blood_work-n" src="THYME-colon-mod">
        <text>Blood work obtained on November 3 , 2007 : Hemoglobin 8.1 .</text>
        <propbank>
          <rel relloc="0 1">Blood work</rel>
        </propbank>
        <amr version="THYME 1.0">
          (s / show-01 :implicit +
            :ARG0 (b / bloodwork-01
              :time (d / date-entity :month 11 :day 3 :year 2007))
            :ARG1 (h / have-value-91
              :ARG1 (a / anatomical-site :name (n / name :op1 "hemoglobin"))
              :ARG2 8.1))
        </amr>
      </example>
      <note>BLOODWORK NOTES: Added for THYME-AMR.</note>
    </roleset>
  </predicate>
</frameset>
