<?xml version='1.0' encoding='UTF-8' standalone='no'?>
<!DOCTYPE frameset PUBLIC "-//PB//PropBank Frame v3.4 Transitional//EN" "http://propbank.org/specification/dtds/v3.4/frameset.dtd">
<frameset>
  <predicate lemma="pg">
    <roleset id="pg.01" name="parental guidance movie rating">
      <aliases>
        <alias pos="j">pg</alias>
      </aliases>
      <roles>
        <role descr="pg movie or entity" f="PPT" n="1"/>
      </roles>
      <usagenotes>
        <usage resource="PropBank" version="1.0" inuse="-"/>
        <usage resource="PropBank" version="2.1.5" inuse="-"/>
        <usage resource="PropBank" version="3.1" inuse="+"/>
        <usage resource="PropBank" version="3.4" inuse="+"/>
        <usage resource="AMR" version="2019" inuse="-"/>
        <usage resource="PropBank" version="Flickr 1.0" inuse="+"/>
        <usage resource="AMR" version="Spatial 1.0" inuse="-"/>
        <usage resource="AMR" version="THYME 1.0" inuse="-"/>
        <usage resource="PropBank" version="3.5" inuse="+"/>
        <usage resource="AMR" version="iSAT 1.0" inuse="+"/>
      </usagenotes>
      <example name="PG-j" src="">
        <text>He lay on the ground while I looked up our class schedule on my iPad ! And he put his hand on my leg -LRB- below the knee ... this is PG after all -RRB- and I clasped his hand and he squeezed mine and we squeezed hands back and forth until I woke</text>
        <propbank>
          <rel relloc="31">PG</rel>
          <arg type="ARG1" start="29" end="29">this</arg>
          <arg type="ARGM-DIS" start="32" end="33">after all</arg>
        </propbank>
      </example>
      <note>PG-J NOTES: Added automatically by Julia. (from pg.01-j)</note>
    </roleset>
  </predicate>
</frameset>
