<?xml version='1.0' encoding='UTF-8' standalone='no'?>
<!DOCTYPE frameset PUBLIC "-//PB//PropBank Frame v3.4 Transitional//EN" "http://propbank.org/specification/dtds/v3.4/frameset.dtd">
<frameset>
  <predicate lemma="slap">
    <roleset id="slap.01" name="hit with a flat object">
      <aliases>
        <alias pos="v">slap</alias>
      </aliases>
      <roles>
        <role descr="agent, hitter - animate only!" f="PAG" n="0">
          <rolelinks>
            <rolelink class="throw-17.1-1" resource="VerbNet" version="verbnet3.3">agent</rolelink>
            <rolelink class="hit-18.1-1" resource="VerbNet" version="verbnet3.3">agent</rolelink>
            <rolelink class="Cause_harm" resource="FrameNet" version="1.7">agent</rolelink>
            <rolelink class="Cause_harm" resource="FrameNet" version="1.7">cause</rolelink>
            <rolelink class="throw-17.1-1" resource="VerbNet" version="verbnet3.4">agent</rolelink>
            <rolelink class="hit-18.1-1" resource="VerbNet" version="verbnet3.4">agent</rolelink>
          </rolelinks>
        </role>
        <role descr="thing hit" f="PPT" n="1">
          <rolelinks>
            <rolelink class="throw-17.1-1" resource="VerbNet" version="verbnet3.3">theme</rolelink>
            <rolelink class="bump-18.4-1" resource="VerbNet" version="verbnet3.3">theme</rolelink>
            <rolelink class="hit-18.1-1" resource="VerbNet" version="verbnet3.3">patient</rolelink>
            <rolelink class="Cause_harm" resource="FrameNet" version="1.7">victim</rolelink>
            <rolelink class="Cause_harm" resource="FrameNet" version="1.7">body_part</rolelink>
            <rolelink class="throw-17.1-1" resource="VerbNet" version="verbnet3.4">theme</rolelink>
            <rolelink class="hit-18.1-1" resource="VerbNet" version="verbnet3.4">patient</rolelink>
            <rolelink class="bump-18.4-1" resource="VerbNet" version="verbnet3.4">theme</rolelink>
          </rolelinks>
        </role>
        <role descr="instrument, thing hit by or with" f="MNR" n="2">
          <rolelinks>
            <rolelink class="hit-18.1-1" resource="VerbNet" version="verbnet3.3">instrument</rolelink>
            <rolelink class="Cause_harm" resource="FrameNet" version="1.7">means</rolelink>
            <rolelink class="Cause_harm" resource="FrameNet" version="1.7">instrument</rolelink>
            <rolelink class="hit-18.1-1" resource="VerbNet" version="verbnet3.4">instrument</rolelink>
            <rolelink class="bump-18.4-1" resource="VerbNet" version="verbnet3.4">location</rolelink>
          </rolelinks>
        </role>
      </roles>
      <usagenotes>
        <usage resource="PropBank" version="1.0" inuse="+"/>
        <usage resource="PropBank" version="2.1.5" inuse="+"/>
        <usage resource="PropBank" version="3.1" inuse="+"/>
        <usage resource="PropBank" version="3.4" inuse="+"/>
        <usage resource="AMR" version="2019" inuse="+"/>
        <usage resource="PropBank" version="Flickr 1.0" inuse="+"/>
        <usage resource="AMR" version="Spatial 1.0" inuse="+"/>
        <usage resource="AMR" version="THYME 1.0" inuse="+"/>
        <usage resource="PropBank" version="3.5" inuse="+"/>
        <usage resource="AMR" version="iSAT 1.0" inuse="+"/>
      </usagenotes>
      <lexlinks>
        <lexlink class="Cause_impact" confidence="0.8" resource="FrameNet" src="manual+strict-conv" version="1.7"/>
        <lexlink class="Impact" confidence="0.8" resource="FrameNet" src="manual+strict-conv" version="1.7"/>
        <lexlink class="Cause_harm" confidence="0.8" resource="FrameNet" src="manual+strict-conv" version="1.7"/>
        <lexlink class="throw-17.1-1" confidence="0.8" resource="VerbNet" src="manual+strict-conv" version="verbnet3.3"/>
        <lexlink class="hit-18.1-1" confidence="0.8" resource="VerbNet" src="manual+strict-conv" version="verbnet3.3"/>
        <lexlink class="bump-18.4-1" confidence="0.8" resource="VerbNet" src="manual+strict-conv" version="verbnet3.3"/>
        <lexlink class="Attack" confidence="0.1" resource="ERE" src="reo-expansion" version="rich"/>
        <lexlink class="slap-v.1" confidence="0.1" resource="onsense" src="annot-overlap" version="on5">8</lexlink>
        <lexlink class="throw-17.1-1" confidence="1.0" resource="VerbNet" src="manualchecks" version="verbnet3.4"/>
        <lexlink class="bump-18.4-1" confidence="1.0" resource="VerbNet" src="manualchecks" version="verbnet3.4"/>
        <lexlink class="hit-18.1-1" confidence="1.0" resource="VerbNet" src="manualchecks" version="verbnet3.4"/>
      </lexlinks>
      <example name="instrumental subject" src="">
        <text>London share prices closed sharply lower Friday in active trading after Chancellor of the Exchequer Nigel Lawson 's resignation slapped the market and Wall Street 's rapid initial sell - off knocked it down .</text>
        <propbank>
          <rel relloc="19">slapped</rel>
          <arg type="ARG2" start="11" end="18">Chancellor of the Exchequer Nigel Lawson 's resignation</arg>
          <arg type="ARG1" start="20" end="21">the market</arg>
        </propbank>
      </example>
      <example name="ARG0 and ARG2 and ARG1" src="ontonotes mz/sinorama/10/ectb_1021">
        <text>Once he came very close to cutting a finger clean off with a sickle , but he just slapped some cement mix -LRB- commonly regarded as a good disinfectant -RRB- on the wound and worked on through the pain .</text>
        <propbank>
          <rel relloc="18">slapped</rel>
          <arg type="ARG0" start="16" end="16">he</arg>
          <arg type="ARGM-ADV" start="17" end="17">just</arg>
          <arg type="ARG2" start="19" end="29">some cement mix -LRB- commonly regarded as a good disinfectant -RRB-</arg>
          <arg type="ARG1" start="30" end="32">on the wound</arg>
        </propbank>
      </example>
      <note>SLAP-V NOTES: Comparison with hit. Member of Vncls throw-17.1-1, bump-18.4-1, hit-18.1-1. Updated by Julia, 11/2010. (from slap.01-v)</note>
    </roleset>
  </predicate>
</frameset>
