<?xml version='1.0' encoding='UTF-8' standalone='no'?>
<!DOCTYPE frameset PUBLIC "-//PB//PropBank Frame v3.4 Transitional//EN" "http://propbank.org/specification/dtds/v3.4/frameset.dtd">
<frameset>
  <predicate lemma="preach">
    <roleset id="preach.01" name="to proclaim or advocate">
      <aliases>
        <alias pos="v">preach</alias>
        <alias pos="n">preaching</alias>
        <argalias arg="0" pos="n">preacher</argalias>
      </aliases>
      <roles>
        <role descr="preacher, agent" f="PAG" n="0">
          <rolelinks>
            <rolelink class="lecture-37.11-1" resource="VerbNet" version="verbnet3.3">agent</rolelink>
            <rolelink class="transfer_mesg-37.1.1" resource="VerbNet" version="verbnet3.3">agent</rolelink>
            <rolelink class="Statement" resource="FrameNet" version="1.7">speaker</rolelink>
            <rolelink class="Speak_on_topic" resource="FrameNet" version="1.7">speaker</rolelink>
            <rolelink class="transfer_mesg-37.1.1" resource="VerbNet" version="verbnet3.4">agent</rolelink>
            <rolelink class="lecture-37.11-1" resource="VerbNet" version="verbnet3.4">agent</rolelink>
          </rolelinks>
        </role>
        <role descr="utterance" f="PPT" n="1">
          <rolelinks>
            <rolelink class="lecture-37.11-1" resource="VerbNet" version="verbnet3.3">topic</rolelink>
            <rolelink class="transfer_mesg-37.1.1" resource="VerbNet" version="verbnet3.3">topic</rolelink>
            <rolelink class="Statement" resource="FrameNet" version="1.7">addressee</rolelink>
            <rolelink class="Statement" resource="FrameNet" version="1.7">message</rolelink>
            <rolelink class="Statement" resource="FrameNet" version="1.7">topic</rolelink>
            <rolelink class="Speak_on_topic" resource="FrameNet" version="1.7">topic</rolelink>
            <rolelink class="transfer_mesg-37.1.1" resource="VerbNet" version="verbnet3.4">topic</rolelink>
            <rolelink class="lecture-37.11-1" resource="VerbNet" version="verbnet3.4">topic</rolelink>
          </rolelinks>
        </role>
      </roles>
      <usagenotes>
        <usage resource="PropBank" version="1.0" inuse="+"/>
        <usage resource="PropBank" version="2.1.5" inuse="+"/>
        <usage resource="PropBank" version="3.1" inuse="+"/>
        <usage resource="PropBank" version="3.4" inuse="+"/>
        <usage resource="AMR" version="2019" inuse="+"/>
        <usage resource="PropBank" version="Flickr 1.0" inuse="+"/>
        <usage resource="AMR" version="Spatial 1.0" inuse="+"/>
        <usage resource="AMR" version="THYME 1.0" inuse="+"/>
        <usage resource="PropBank" version="3.5" inuse="+"/>
        <usage resource="AMR" version="iSAT 1.0" inuse="+"/>
      </usagenotes>
      <lexlinks>
        <lexlink class="Statement" confidence="0.8" resource="FrameNet" src="manual+strict-conv" version="1.7"/>
        <lexlink class="Speak_on_topic" confidence="0.8" resource="FrameNet" src="manual+strict-conv" version="1.7"/>
        <lexlink class="lecture-37.11-1" confidence="0.8" resource="VerbNet" src="manual+strict-conv" version="verbnet3.3"/>
        <lexlink class="transfer_mesg-37.1.1" confidence="0.8" resource="VerbNet" src="manual+strict-conv" version="verbnet3.3"/>
        <lexlink class="Contact.MediaStatement.Broadcast" confidence="0.1" resource="AidaOntology" src="reo-expansion" version="Jan2019"/>
        <lexlink class="Contact.PublicStatementInPerson.Broadcast" confidence="0.1" resource="AidaOntology" src="reo-expansion" version="Jan2019"/>
        <lexlink class="Broadcast" confidence="0.1" resource="ERE" src="reo-expansion" version="rich"/>
        <lexlink class="preach-v.2" confidence="0.1" resource="onsense" src="annot-overlap" version="on5">4</lexlink>
        <lexlink class="lecture-37.11-1" confidence="1.0" resource="VerbNet" src="manualchecks" version="verbnet3.4"/>
        <lexlink class="transfer_mesg-37.1.1" confidence="1.0" resource="VerbNet" src="manualchecks" version="verbnet3.4"/>
      </lexlinks>
      <example name="preach-v: transitive" src="">
        <text>Others preach the gospel of buying only blue - chip growth stocks .</text>
        <propbank>
          <rel relloc="1">preach</rel>
          <arg type="ARG0" start="0" end="0">Others</arg>
          <arg type="ARG1" start="2" end="11">the gospel of buying only blue - chip growth stocks</arg>
        </propbank>
      </example>
      <example name="preach-v: preach about" src="">
        <text>Part of the problem is the tendency of all sitcoms , ever since the didactic days of Norman Lear , to preach about social issues .</text>
        <propbank>
          <rel relloc="21">preach</rel>
          <arg type="ARG0" start="8" end="9">all sitcoms</arg>
          <arg type="ARG1" start="22" end="24">about social issues</arg>
        </propbank>
      </example>
      <note>PREACH-V NOTES: Frames file for 'preach' based on survey of sentences in the WSJ corpus. (from preach.01-v predicate notes)</note>
    </roleset>
  </predicate>
</frameset>
