<?xml version='1.0' encoding='UTF-8' standalone='no'?>
<!DOCTYPE frameset PUBLIC "-//PB//PropBank Frame v3.4 Transitional//EN" "http://propbank.org/specification/dtds/v3.4/frameset.dtd">
<frameset>
  <predicate lemma="storm">
    <roleset id="storm.01" name="bad weather">
      <aliases>
        <alias pos="v">storm</alias>
      </aliases>
      <roles>
        <role descr="Cognate object, entity stormed e.g. cats and dogs, golf balls, rain itself" f="PPT" n="1">
          <rolelinks>
            <rolelink class="weather-57" resource="VerbNet" version="verbnet3.3">theme</rolelink>
            <rolelink class="weather-57" resource="VerbNet" version="verbnet3.4">theme</rolelink>
          </rolelinks>
        </role>
      </roles>
      <usagenotes>
        <usage resource="PropBank" version="1.0" inuse="+"/>
        <usage resource="PropBank" version="2.1.5" inuse="+"/>
        <usage resource="PropBank" version="3.1" inuse="+"/>
        <usage resource="PropBank" version="3.4" inuse="+"/>
        <usage resource="AMR" version="2019" inuse="+"/>
        <usage resource="PropBank" version="Flickr 1.0" inuse="+"/>
        <usage resource="AMR" version="Spatial 1.0" inuse="+"/>
        <usage resource="AMR" version="THYME 1.0" inuse="+"/>
        <usage resource="PropBank" version="3.5" inuse="+"/>
        <usage resource="AMR" version="iSAT 1.0" inuse="+"/>
      </usagenotes>
      <lexlinks>
        <lexlink class="Weather" confidence="0.8" resource="FrameNet" src="manual+strict-conv" version="1.7"/>
        <lexlink class="weather-57" confidence="0.8" resource="VerbNet" src="manual+strict-conv" version="verbnet3.3"/>
        <lexlink class="weather-57" confidence="1.0" resource="VerbNet" src="manualchecks" version="verbnet3.4"/>
      </lexlinks>
      <example name="storm-v: stormy weather...." src="">
        <text>`` Wow , '' said John , `` it 's really storming outside . ''</text>
        <propbank>
          <rel relloc="11">storming</rel>
          <arg type="ARGM-MNR" start="10" end="10">really</arg>
          <arg type="ARGM-LOC" start="12" end="12">outside</arg>
        </propbank>
      </example>
      <note>STORM-V NOTES: Based on WSJ. Member of VNcls weather-57. (from storm.01-v)</note>
      <note>Don't tag weather "it". Unlikely that this will ever take args. (from storm.01-v)</note>
    </roleset>
    <roleset id="storm.02" name="move violently">
      <aliases>
        <alias pos="v">storm</alias>
      </aliases>
      <roles>
        <role descr="entity in motion" f="PAG" n="0">
          <rolelinks>
            <rolelink class="Self_motion" resource="FrameNet" version="1.7">self_mover</rolelink>
            <rolelink class="Attack" resource="FrameNet" version="1.7">victim</rolelink>
          </rolelinks>
        </role>
        <role descr="path" f="DIR" n="1">
          <rolelinks>
            <rolelink class="Self_motion" resource="FrameNet" version="1.7">goal</rolelink>
            <rolelink class="Self_motion" resource="FrameNet" version="1.7">path</rolelink>
            <rolelink class="Attack" resource="FrameNet" version="1.7">place</rolelink>
            <rolelink class="Attack" resource="FrameNet" version="1.7">path</rolelink>
          </rolelinks>
        </role>
      </roles>
      <usagenotes>
        <usage resource="PropBank" version="1.0" inuse="+"/>
        <usage resource="PropBank" version="2.1.5" inuse="+"/>
        <usage resource="PropBank" version="3.1" inuse="+"/>
        <usage resource="PropBank" version="3.4" inuse="+"/>
        <usage resource="AMR" version="2019" inuse="+"/>
        <usage resource="PropBank" version="Flickr 1.0" inuse="+"/>
        <usage resource="AMR" version="Spatial 1.0" inuse="+"/>
        <usage resource="AMR" version="THYME 1.0" inuse="+"/>
        <usage resource="PropBank" version="3.5" inuse="+"/>
        <usage resource="AMR" version="iSAT 1.0" inuse="+"/>
      </usagenotes>
      <lexlinks>
        <lexlink class="Self_motion" confidence="0.8" resource="FrameNet" src="manual+strict-conv" version="1.7"/>
        <lexlink class="Attack" confidence="0.8" resource="FrameNet" src="manual+strict-conv" version="1.7"/>
        <lexlink class="Movement.TransportPerson.SelfMotion" confidence="0.1" resource="AidaOntology" src="reo-expansion" version="Jan2019"/>
        <lexlink class="Transportperson" confidence="0.1" resource="ERE" src="reo-expansion" version="rich"/>
        <lexlink class="Attack" confidence="0.1" resource="ERE" src="reo-expansion" version="rich"/>
        <lexlink class="storm-v.2" confidence="0.1" resource="onsense" src="annot-overlap" version="on5">13</lexlink>
      </lexlinks>
      <example name="storm-v: sorta path-ish" src="">
        <text>Another described how tax - collection officials in Thanh Hoa province one night stormed through homes and confiscated rice from starving villagers .</text>
        <propbank>
          <rel relloc="13">stormed</rel>
          <arg type="ARG0" start="3" end="10">tax - collection officials in Thanh Hoa province</arg>
          <arg type="ARGM-TMP" start="11" end="12">one night</arg>
          <arg type="ARG1" start="14" end="15">through homes</arg>
        </propbank>
      </example>
      <example name="storm-v: definitely path, maybe different sense" src="">
        <text>The pillars of apartheid may be trembling in the rest of South Africa , with Johannesburg opening its public facilities to all races , blacks storming the all - white beaches of the Cape and the government releasing seven leaders of the banned African National Congress .</text>
        <propbank>
          <rel relloc="25">storming</rel>
          <arg type="ARG0" start="24" end="24">blacks</arg>
          <arg type="ARG1" start="26" end="33">the all - white beaches of the Cape</arg>
        </propbank>
      </example>
      <note>STORM-V NOTES: No Vncls. (from storm.02-v)</note>
    </roleset>
  </predicate>
</frameset>
