<?xml version="1.0" encoding="utf-8" standalone="no"?>
<!DOCTYPE frameset PUBLIC "-//PB//PropBank Frame v3.4 Transitional//EN" "http://propbank.org/specification/dtds/v3.4/frameset.dtd">
<frameset>
  <predicate lemma="exclude">
    <roleset id="exclude.01" name="exclude, except">
      <aliases>
        <alias pos="j">exclusive</alias>
        <alias pos="v">exclude</alias>
        <alias pos="n">exclusion</alias>
      </aliases>
      <roles>
        <role descr="agent, excluder" f="PAG" n="0">
          <rolelinks>
            <rolelink class="65" resource="VerbNet" version="UNK">agent</rolelink>
            <rolelink class="forbid-64.4-1" resource="VerbNet" version="verbnet3.4">agent</rolelink>
            <rolelink class="exclude-107.3-1" resource="VerbNet" version="verbnet3.4">agent</rolelink>
          </rolelinks>
        </role>
        <role descr="patient, thing excluded" f="PPT" n="1">
          <rolelinks>
            <rolelink class="65" resource="VerbNet" version="UNK">theme</rolelink>
            <rolelink class="forbid-64.4-1" resource="VerbNet" version="verbnet3.4">theme</rolelink>
            <rolelink class="exclude-107.3-1" resource="VerbNet" version="verbnet3.4">theme</rolelink>
          </rolelinks>
        </role>
        <role descr="excluded-from" f="VSP" n="2">
          <rolelinks>
            <rolelink class="65" resource="VerbNet" version="UNK">location</rolelink>
          </rolelinks>
        </role>
      </roles>
      <usagenotes>
        <usage resource="PropBank" version="1.0" inuse="+"/>
        <usage resource="PropBank" version="2.1.5" inuse="+"/>
        <usage resource="PropBank" version="3.1" inuse="+"/>
        <usage resource="PropBank" version="3.4" inuse="+"/>
        <usage resource="AMR" version="2019" inuse="+"/>
        <usage resource="PropBank" version="Flickr 1.0" inuse="+"/>
        </usagenotes>
      <lexlinks>
        <lexlink class="Inclusion" confidence="0.8" resource="FrameNet" src="manual+strict-conv" version="1.7"/>
        <lexlink class="Exclude_member" confidence="0.8" resource="FrameNet" src="manual+strict-conv" version="1.7"/>
        <lexlink class="exclude-107.3-1" confidence="1.0" resource="VerbNet" src="manualchecks" version="verbnet3.4"/>
        <lexlink class="forbid-64.4-1" confidence="1.0" resource="VerbNet" src="manualchecks" version="verbnet3.4"/>
      </lexlinks>
      <example name="exclude-v: discourse function, with (empty) arg0" src="">
        <text>*trace* Excluding one - time additions to profit in each year , earnings per share were $ 2.47 , up 7.4 % from $ 2.30 in fiscal 1988 .</text>
        <propbank>
          <rel relloc="1">Excluding</rel>
          <arg type="ARG0" start="?" end="?">*trace*</arg>
          <arg type="ARG1" start="2" end="10">one - time additions to profit in each year</arg>
        </propbank>
      </example>
      <example name="exclude-v: discourse function, no arg0" src="">
        <text>Still , the combined profit of Ford , Chrysler Corp. and General Motors Corp. fell 44 % to $ 1.02 billion from $ 1.83 billion a year earlier , excluding a one - time gain of $ 309 million at Chrysler from the sale of Mitsubishi Motors Corp. stock .</text>
        <propbank>
          <rel relloc="29">excluding</rel>
          <arg type="ARG1" start="30" end="48">a one - time gain of $ 309 million at Chrysler from the sale of Mitsubishi Motors Corp. stock</arg>
        </propbank>
      </example>
      <example name="exclude-v: real verbal, transitive" src="">
        <text>The figures exclude businesses now organized as American Express Information Services Co.</text>
        <propbank>
          <rel relloc="2">exclude</rel>
          <arg type="ARG0" start="0" end="1">The figures</arg>
          <arg type="ARG1" start="3" end="11">businesses now organized as American Express Information Services Co.</arg>
        </propbank>
      </example>
      <example name="exclude-v: with excluded-from" src="">
        <text>The federal appeals court held that the nominal damages and the failure to prove all claims did n't exclude the USFL from being reimbursed .</text>
        <propbank>
          <rel relloc="18">exclude</rel>
          <arg type="ARG0" start="6" end="15">the nominal damages and the failure to prove all claims</arg>
          <arg type="ARGM-NEG" start="17" end="17">n't</arg>
          <arg type="ARG1" start="19" end="20">the USFL</arg>
          <arg type="ARG2" start="21" end="23">from being reimbursed</arg>
        </propbank>
      </example>
      <example name="exclusion-n: Args 1 and 2" src="">
        <text>the exclusion of the company 's British sales from the current year 's figures</text>
        <propbank>
          <rel relloc="1">exclusion</rel>
          <arg type="ARG1" start="2" end="7">of the company 's British sales</arg>
          <arg type="ARG2" start="8" end="13">from the current year 's figures</arg>
        </propbank>
      </example>
      <example name="exclusion-n: args 1 and 2 again" src="">
        <text>the exclusion from elections of those charged with but not yet convicted of the relevant offences</text>
        <propbank>
          <rel relloc="1">exclusion</rel>
          <arg type="ARG2" start="2" end="3">from elections</arg>
          <arg type="ARG1" start="4" end="15">of those charged with but not yet convicted of the relevant offences</arg>
        </propbank>
      </example>
      <example name="exclusion-n: All args" src="">
        <text>His exclusion of his sister from the wedding party caused considerable family discord .</text>
        <propbank>
          <rel relloc="1">exclusion</rel>
          <arg type="ARG0" start="0" end="0">His</arg>
          <arg type="ARG1" start="2" end="4">of his sister</arg>
          <arg type="ARG2" start="5" end="8">from the wedding party</arg>
        </propbank>
      </example>
      <example name="exclusive-j: mutually exclusive" src="BOLT-7">
        <text>In fact , commodity housing market and government - regulated market are to a large extent , not mutually exclusive .</text>
        <propbank>
          <rel relloc="19">exclusive</rel>
          <arg type="ARGM-DIS" start="0" end="1">In fact</arg>
          <arg type="ARG0" start="3" end="10">commodity housing market and government - regulated market</arg>
          <arg type="ARGM-EXT" start="12" end="15">to a large extent</arg>
          <arg type="ARGM-NEG" start="17" end="17">not</arg>
          <arg type="ARG1" start="18" end="18">mutually</arg>
        </propbank>
      </example>
      <example name="exclusive-j: args 0, 1" src="BOLT-7">
        <text>Our room rate was exclusive of breakfast</text>
        <propbank>
          <rel relloc="4">exclusive</rel>
          <arg type="ARG0" start="0" end="2">Our room rate</arg>
          <arg type="ARG1" start="5" end="6">of breakfast</arg>
        </propbank>
      </example>
      <note>EXCLUDE-V NOTES: Frames file for 'exclude' based on sentences in financial subcorpus. Member of VNcls admit-65. No comparison.(from exclude.01-v)</note>
      <note>EXCLUSION-N NOTES: Based on sentences in nouns-00040.Comparison to 'exclude.01'. Vn class admit-65. Framed by Katie.(from exclusion.01-n)</note>
      <note>EXCLUSIVE-J NOTES: Automatically created by Julia as an aliasfile for unification.(from exclusive.01-j)</note>
    </roleset>
  </predicate>
  <predicate lemma="exclusive">
    <roleset id="exclusive.02" name="snobbish, reserved for a select elite group">
      <aliases>
        <alias pos="j">exclusive</alias>
      </aliases>
      <roles>
        <role descr="exclusive entity/location/organization" f="PAG" n="0"/>
        <role descr="elite group reserved for" f="PPT" n="1"/>
        <role descr="group excluded" f="VSP" n="2"/>
      </roles>
      <usagenotes>
        <usage resource="PropBank" version="1.0" inuse="-"/>
        <usage resource="PropBank" version="2.1.5" inuse="-"/>
        <usage resource="PropBank" version="3.1" inuse="+"/>
        <usage resource="PropBank" version="3.4" inuse="+"/>
        <usage resource="AMR" version="2019" inuse="+"/>
        <usage resource="PropBank" version="Flickr 1.0" inuse="+"/>
        </usagenotes>
      <lexlinks/>
      <example name="exclusive-j" src="">
        <text>The infinity pool was exclusive for guests who booked a room for overnight stay so the pool is n't overcrowded and you would have a little privacy ( although , there were occasional sneaks from " day - users " using the infinity pool ) .</text>
        <propbank>
          <rel relloc="4">exclusive</rel>
          <arg type="ARG0" start="0" end="2">The infinity pool</arg>
          <arg type="ARG1" start="5" end="13">for guests who booked a room for overnight stay</arg>
          <arg type="ARGM-ADV" start="14" end="44">so the pool is n't overcrowded and you would have a little privacy ( although , there were occasional sneaks from " day - users " using the infinity pool )</arg>
        </propbank>
      </example>
      <note>EXCLUSIVE-J NOTES: Split off from original 'exclusive-j' roleset by Julia for unification.</note>
    </roleset>
  </predicate>
</frameset>
