<?xml version='1.0' encoding='UTF-8' standalone='no'?>
<!DOCTYPE frameset PUBLIC "-//PB//PropBank Frame v3.4 Transitional//EN" "http://propbank.org/specification/dtds/v3.4/frameset.dtd">
<frameset>
  <predicate lemma="elapse">
    <roleset id="elapse.01" name="go by, as time">
      <aliases>
        <alias pos="v">elapse</alias>
      </aliases>
      <roles>
        <role descr="time gone by" f="PPT" n="1"/>
      </roles>
      <usagenotes>
        <usage resource="PropBank" version="1.0" inuse="+"/>
        <usage resource="PropBank" version="2.1.5" inuse="+"/>
        <usage resource="PropBank" version="3.1" inuse="+"/>
        <usage resource="PropBank" version="3.4" inuse="+"/>
        <usage resource="AMR" version="2019" inuse="+"/>
        <usage resource="PropBank" version="Flickr 1.0" inuse="+"/>
        <usage resource="AMR" version="Spatial 1.0" inuse="+"/>
        <usage resource="AMR" version="THYME 1.0" inuse="+"/>
        <usage resource="PropBank" version="3.5" inuse="+"/>
        <usage resource="AMR" version="iSAT 1.0" inuse="+"/>
      </usagenotes>
      <lexlinks/>
      <example name="one example" src="">
        <text>But the Beebes did n't come to that conclusion until time limits had elapsed for adding the adhesives maker as a defendant in the case , Ms. Adams said .</text>
        <propbank>
          <rel relloc="13">elapsed</rel>
          <arg type="ARG1" start="10" end="11">time limits</arg>
          <arg type="C-ARG1" start="14" end="24">for adding the adhesives maker as a defendant in the case</arg>
        </propbank>
      </example>
      <note>ELAPSE-V NOTES: Frames file for 'elapse' based on sentences in wsj. No Verbnet entry. (from elapse.01-v predicate notes)</note>
    </roleset>
  </predicate>
</frameset>
