<?xml version='1.0' encoding='UTF-8' standalone='no'?>
<!DOCTYPE frameset PUBLIC "-//PB//PropBank Frame v3.4 Transitional//EN" "http://propbank.org/specification/dtds/v3.4/frameset.dtd">
<frameset>
  <predicate lemma="outcry">
    <roleset id="outcry.01" name="speaking out against">
      <aliases>
        <alias pos="n">outcry</alias>
      </aliases>
      <roles>
        <role descr="speaker" f="PAG" n="0"/>
        <role descr="spoken out against/about" f="PPT" n="1"/>
        <role descr="listener" f="GOL" n="2"/>
        <role descr="for what (if in addition to arg1)" f="CAU" n="3"/>
      </roles>
      <usagenotes>
        <usage resource="PropBank" version="1.0" inuse="-"/>
        <usage resource="PropBank" version="2.1.5" inuse="-"/>
        <usage resource="PropBank" version="3.1" inuse="+"/>
        <usage resource="PropBank" version="3.4" inuse="+"/>
        <usage resource="AMR" version="2019" inuse="-"/>
        <usage resource="PropBank" version="Flickr 1.0" inuse="+"/>
        <usage resource="AMR" version="Spatial 1.0" inuse="-"/>
        <usage resource="AMR" version="THYME 1.0" inuse="-"/>
        <usage resource="PropBank" version="3.5" inuse="+"/>
        <usage resource="AMR" version="iSAT 1.0" inuse="+"/>
      </usagenotes>
      <lexlinks/>
      <example name="args 1, 3" src="internet">
        <text>I do n't see the need for the outcry against him for stating an opinion ; instead , just form an opinion .</text>
        <propbank>
          <rel relloc="8">outcry</rel>
          <arg type="ARG1" start="9" end="10">against him</arg>
          <arg type="ARG3" start="11" end="14">for stating an opinion</arg>
        </propbank>
      </example>
      <example name="Arg2" src="internet">
        <text>... healing could begin with their outcry to a friend , family member , or an anonymous call to a hotline .</text>
        <propbank>
          <rel relloc="6">outcry</rel>
          <arg type="ARG2" start="7" end="20">to a friend , family member , or an anonymous call to a hotline</arg>
        </propbank>
      </example>
      <example name="args 0, 1, ADJ" src="BOLT">
        <text>Where 's the public outcry about Russian veto and unilateralism -LRB- a criticism routinely employed - rightly - against the United States when it vetoes resolutions on Israeli aggression -RRB- ?</text>
        <propbank>
          <rel relloc="4">outcry</rel>
          <arg type="ARG0" start="3" end="3">public</arg>
          <arg type="ARG1" start="5" end="9">about Russian veto and unilateralism</arg>
          <arg type="ARGM-ADJ" start="10" end="29">-LRB- a criticism routinely employed - rightly - against the United States when it vetoes resolutions on Israeli aggression -RRB-</arg>
        </propbank>
      </example>
      <note>OUTCRY-N NOTES: Added by Julia based on BOLT, WordNet. No VNcls. (from outcry.01-n)</note>
    </roleset>
  </predicate>
</frameset>
