<?xml version='1.0' encoding='UTF-8' standalone='no'?>
<!DOCTYPE frameset PUBLIC "-//PB//PropBank Frame v3.4 Transitional//EN" "http://propbank.org/specification/dtds/v3.4/frameset.dtd">
<frameset>
  <predicate lemma="quilt">
    <roleset id="quilt.01" name="sew or stitch together">
      <aliases>
        <alias pos="v">quilt</alias>
        <alias pos="n">quilting</alias>
      </aliases>
      <roles>
        <role descr="quilter, agent" f="PAG" n="0"/>
        <role descr="material, things being quilted" f="PPT" n="1"/>
        <role descr="attached to if seperate from arg 1, quilted where" f="LOC" n="2"/>
        <role descr="product, end state" f="PRD" n="3"/>
      </roles>
      <usagenotes>
        <usage resource="PropBank" version="1.0" inuse="-"/>
        <usage resource="PropBank" version="2.1.5" inuse="-"/>
        <usage resource="PropBank" version="3.1" inuse="+"/>
        <usage resource="PropBank" version="3.4" inuse="+"/>
        <usage resource="AMR" version="2019" inuse="-"/>
        <usage resource="PropBank" version="Flickr 1.0" inuse="+"/>
        <usage resource="AMR" version="Spatial 1.0" inuse="-"/>
        <usage resource="AMR" version="THYME 1.0" inuse="-"/>
        <usage resource="PropBank" version="3.5" inuse="+"/>
        <usage resource="AMR" version="iSAT 1.0" inuse="+"/>
      </usagenotes>
      <lexlinks/>
      <example name="args 1 and 2" src="">
        <text>Organic French wool is quilted onto that</text>
        <propbank>
          <rel relloc="4">quilted</rel>
          <arg type="ARG1" start="0" end="2">Organic French wool</arg>
          <arg type="ARG2" start="5" end="6">onto that</arg>
        </propbank>
      </example>
      <example name="arg 3" src="">
        <text>After quilting the squares together ,</text>
        <propbank>
          <rel relloc="1">quilting</rel>
          <arg type="ARG1" start="2" end="3">the squares</arg>
          <arg type="ARG3" start="4" end="4">together</arg>
        </propbank>
      </example>
      <note>QUILTING-N NOTES: Based on Google data. Comparison with sew.01 and stitch.01. No VN or FN classes. Framed by Katie. (from quilting.01-n) </note>
    </roleset>
  </predicate>
</frameset>
