<?xml version='1.0' encoding='UTF-8' standalone='no'?>
<!DOCTYPE frameset PUBLIC "-//PB//PropBank Frame v3.4 Transitional//EN" "http://propbank.org/specification/dtds/v3.4/frameset.dtd">
<frameset>
  <predicate lemma="dorm">
    <roleset id="dorm.01" name="staying in a dorm">
      <aliases>
        <alias pos="n">dorming</alias>
        <alias pos="v">dorm</alias>
      </aliases>
      <roles>
        <role descr="first entity staying in a dorm" f="PAG" n="0"/>
        <role descr="roommates" f="PPT" n="1"/>
        <role descr="location, dorm" f="LOC" n="2"/>
      </roles>
      <usagenotes>
        <usage resource="PropBank" version="1.0" inuse="-"/>
        <usage resource="PropBank" version="2.1.5" inuse="-"/>
        <usage resource="PropBank" version="3.1" inuse="+"/>
        <usage resource="PropBank" version="3.4" inuse="+"/>
        <usage resource="AMR" version="2019" inuse="-"/>
        <usage resource="PropBank" version="Flickr 1.0" inuse="+"/>
        <usage resource="AMR" version="Spatial 1.0" inuse="-"/>
        <usage resource="AMR" version="THYME 1.0" inuse="-"/>
        <usage resource="PropBank" version="3.5" inuse="+"/>
        <usage resource="AMR" version="iSAT 1.0" inuse="+"/>
      </usagenotes>
      <example name="dorm-b: arg0" src="SMS">
        <text>I dormed with my best friend Freshman year</text>
        <propbank>
          <rel relloc="1">dormed</rel>
          <arg type="ARG0" start="0" end="0">I</arg>
          <arg type="ARG1" start="2" end="5">with my best friend</arg>
          <arg type="ARGM-TMP" start="6" end="7">Freshman year</arg>
        </propbank>
      </example>
      <note>DORMING-N NOTES: Added by Julia based on SMS. (from dorming.01-n)</note>
      <note>DORM-V NOTES: Automatically added alias.</note>
    </roleset>
  </predicate>
</frameset>
