<?xml version='1.0' encoding='UTF-8' standalone='no'?>
<!DOCTYPE frameset PUBLIC "-//PB//PropBank Frame v3.4 Transitional//EN" "http://propbank.org/specification/dtds/v3.4/frameset.dtd">
<frameset>
  <predicate lemma="rife">
    <roleset id="rife.01" name="teeming, abundant">
      <aliases>
        <alias pos="j">rife</alias>
      </aliases>
      <roles>
        <role descr="location (perhaps abstract) teeming with arg2" f="LOC" n="1"/>
        <role descr="theme, abundant thing" f="PPT" n="2"/>
      </roles>
      <usagenotes>
        <usage resource="PropBank" version="1.0" inuse="-"/>
        <usage resource="PropBank" version="2.1.5" inuse="-"/>
        <usage resource="PropBank" version="3.1" inuse="+"/>
        <usage resource="PropBank" version="3.4" inuse="+"/>
        <usage resource="AMR" version="2019" inuse="-"/>
        <usage resource="PropBank" version="Flickr 1.0" inuse="+"/>
        <usage resource="AMR" version="Spatial 1.0" inuse="-"/>
        <usage resource="AMR" version="THYME 1.0" inuse="-"/>
        <usage resource="PropBank" version="3.5" inuse="+"/>
        <usage resource="AMR" version="iSAT 1.0" inuse="+"/>
      </usagenotes>
      <lexlinks>
        <lexlink class="Abounding_with" confidence="0.8" resource="FrameNet" src="manual+strict-conv" version="1.7"/>
      </lexlinks>
      <example name="both args" src="internet">
        <text>The history of technology is rife with stories and accounts of revolutionary approaches overturning the status quo .</text>
        <propbank>
          <rel relloc="5">rife</rel>
          <arg type="ARG1" start="0" end="3">The history of technology</arg>
          <arg type="ARG2" start="6" end="16">with stories and accounts of revolutionary approaches overturning the status quo</arg>
        </propbank>
      </example>
      <example name="arg2" src="BOLT-2,3">
        <text>Youth unemployment is rife at the moment so let 's get them piloting our aeroplanes .</text>
        <propbank>
          <rel relloc="3">rife</rel>
          <arg type="ARG2" start="0" end="1">Youth unemployment</arg>
          <arg type="ARGM-TMP" start="4" end="6">at the moment</arg>
        </propbank>
      </example>
      <note>RIFE-J NOTES: Added by Julia based on BOLT-2,3. (from rife.01-j)</note>
    </roleset>
  </predicate>
</frameset>
